{
  "$schema": "https://json-schema.org/draft/2020-12/schema",
  "$id": "https://mottmac.com/schemas/highway-segmentation/run-spec/v1.0.0",
  "title": "Highway Segmentation Analysis Run Spec",
  "description": "Schema for a headless (CLI) analysis run specification. This file is intended to be generated by the GUI and consumed by the CLI runner.",
  "version": "1.0.0",
  "type": "object",
  "additionalProperties": false,
  "required": ["spec_version", "input", "method", "output"],

  "properties": {
    "$schema": {
      "type": "string",
      "format": "uri",
      "description": "Optional URI of the schema used to validate this run spec"
    },

    "spec_version": {
      "type": "string",
      "pattern": "^\\d+\\.\\d+\\.\\d+$",
      "description": "Version of this run-spec format (semver)"
    },

    "created_at": {
      "type": "string",
      "format": "date-time",
      "description": "Optional creation timestamp (ISO 8601)"
    },

    "software_version": {
      "type": "object",
      "additionalProperties": false,
      "properties": {
        "application": { "type": "string" },
        "version": { "type": "string" }
      },
      "description": "Optional application metadata (for reproducibility)"
    },

    "input": {
      "type": "object",
      "additionalProperties": false,
      "required": ["data_file_path", "x_column", "y_column", "gap_threshold"],
      "properties": {
        "data_file_path": {
          "type": "string",
          "minLength": 1,
          "description": "Path to the input CSV/XLSX file"
        },

        "x_column": {
          "type": "string",
          "minLength": 1,
          "description": "Column name used as the X-axis (distance/position)"
        },

        "y_column": {
          "type": "string",
          "minLength": 1,
          "description": "Column name used as the Y-axis (measurement value)"
        },

        "gap_threshold": {
          "type": "number",
          "exclusiveMinimum": 0,
          "description": "Gap threshold (units of the X-axis). Must be > 0"
        },

        "route_column": {
          "description": "Optional route ID column name. If null/omitted, treat the dataset as a single route",
          "anyOf": [
            {"type": "string", "minLength": 1},
            {"type": "null"}
          ]
        },

        "selected_routes": {
          "type": ["array", "null"],
          "items": { "type": "string", "minLength": 1 },
          "description": "Optional explicit list of routes to process. If null/omitted, process all routes"
        },

        "must_break_columns": {
          "type": ["array", "null"],
          "items": { "type": "string", "minLength": 1 },
          "description": "Optional list of primary attribute columns that force a mandatory breakpoint when their value changes. Applied after gap analysis and before primary preprocessing. If null/omitted, no primary attribute must-breaks are applied."
        },

        "secondary_break_columns": {
          "type": ["array", "null"],
          "items": { "type": "string", "minLength": 1 },
          "description": "Optional list of secondary attribute columns that force a mandatory breakpoint when their value changes. Applied after primary preprocessing and before secondary preprocessing, and tracked separately for reporting. If null/omitted, no secondary attribute must-breaks are applied."
        }
      }
    },

    "method": {
      "type": "object",
      "additionalProperties": false,
      "required": ["method_key", "method_parameters"],
      "properties": {
        "method_key": {
          "type": "string",
          "minLength": 1,
          "description": "Optimization/analysis method key (must correspond to a configured method_key in src/config.py)"
        },

        "method_parameters": {
          "type": "object",
          "description": "Method-scoped parameters passed to the selected analysis method. This is intentionally flexible to support new methods without changing the schema.",
          "additionalProperties": true
        }
      }
    },

    "preprocessing": {
      "type": "object",
      "additionalProperties": false,
      "description": "Optional preprocessing configuration for data cleaning and outlier handling before analysis",
      "properties": {
        "enabled": {
          "type": "boolean",
          "default": true,
          "description": "Master switch to enable/disable all preprocessing. When false, all preprocessing phases are skipped."
        },

        "pre_gap_method": {
          "description": "Optional preprocessing method to apply before gap analysis. Method key must exist in PREPROCESSING_METHODS registry.",
          "anyOf": [
            {"type": "string", "minLength": 1},
            {"type": "null"}
          ]
        },

        "pre_gap_parameters": {
          "type": "object",
          "default": {},
          "description": "Parameters for the pre-gap preprocessing method. Schema is method-specific.",
          "additionalProperties": true
        },

        "primary_method": {
          "description": "Optional primary preprocessing method to apply after gap analysis and primary attribute breaks. This is the most commonly used preprocessing phase.",
          "anyOf": [
            {"type": "string", "minLength": 1},
            {"type": "null"}
          ]
        },

        "primary_parameters": {
          "type": "object",
          "default": {},
          "description": "Parameters for the primary preprocessing method. Schema is method-specific.",
          "additionalProperties": true
        },

        "secondary_method": {
          "description": "Optional secondary preprocessing method to apply after secondary attribute breaks. Used for multi-stage preprocessing workflows.",
          "anyOf": [
            {"type": "string", "minLength": 1},
            {"type": "null"}
          ]
        },

        "secondary_parameters": {
          "type": "object",
          "default": {},
          "description": "Parameters for the secondary preprocessing method. Schema is method-specific.",
          "additionalProperties": true
        }
      }
    },

    "output": {
      "type": "object",
      "additionalProperties": false,
      "required": ["output_json_path"],
      "properties": {
        "output_json_path": {
          "type": "string",
          "minLength": 1,
          "description": "Path to write the schema-compliant JSON results"
        },

        "overwrite": {
          "type": "boolean",
          "default": false,
          "description": "If true, allow overwriting an existing output file"
        }
      }
    }
  }
}
